{"seq":950,"ts":"2026-08-23T22:50:03Z","session":"s_01ARYZ6S41TSV4RRFFQ69G5FAV","turn":"t_01ARYZ6S41TSV4RRFFQ69G5FAW","type":"log","data":{"level":"warn","code":"model_rotated","field":"model","was":"stealth/ox-alpha","became":"qwen/qwen3-coder:free","message":"rotated after a temporary provider limit"}}
