{"seq":801,"ts":"2026-08-23T22:01:03Z","session":"s_01ARYZ6S41TSV4RRFFQ69G5FAV","turn":"t_01ARYZ6S41TSV4RRFFQ69G5FAW","type":"subagent.started","data":{"id":"k_01ARYZ6S41TSV4RRFFQ69G5FAX","child_turn":"t_01ARYZ6S41TSV4RRFFQ69G5FAY","task":"verify the protocol contract","mode":"task","index":1,"total":3}}
