{"seq":804,"ts":"2026-08-23T22:01:03Z","session":"s_01ARYZ6S41TSV4RRFFQ69G5FAV","turn":"t_01ARYZ6S41TSV4RRFFQ69G5FAW","type":"work.updated","data":{"id":"k_01ARYZ6S41TSV4RRFFQ69G5FAX","child_turn":"t_01ARYZ6S41TSV4RRFFQ69G5FAY","role":"subagent","state":"working","phase":"tool","step":"running focused tests","sequence":4,"index":1,"total":3,"model":"gpt-5.6-luna","effort":"medium"}}
